{
  "schema_version": 1,
  "target_kind": "unpromoted_successor_recovery_subset",
  "target_name": "core-dev-successor-recovery",
  "required_class_id": "class.grave_arbalist",
  "required_hall_id": "hub.lantern_halls_01",
  "required_appearance_id": "sprite.class.grave_arbalist",
  "required_copy_ids": [
    "successor.surface.eyebrow",
    "successor.surface.title",
    "successor.surface.subtitle",
    "successor.badge.selected",
    "successor.field.level",
    "successor.field.slot",
    "successor.field.oath_none",
    "successor.field.new_starter_kit",
    "successor.field.safe_character_select",
    "successor.field.confirmation_one",
    "successor.field.confirmation_two",
    "successor.action.play",
    "successor.action.retry",
    "successor.input.play",
    "successor.status.creating",
    "successor.status.ready",
    "successor.status.entering_hall",
    "successor.status.loading_hall",
    "successor.status.hall_ready",
    "successor.status.recoverable",
    "successor.status.fatal",
    "successor.status.update",
    "successor.footer.clean_recovery",
    "successor.footer.authority"
  ],
  "expected_records_blake3": "722b7e16147dd4ba95082e93727b940383d4199b9d013424f68fbc00a354ddb8",
  "expected_localization_blake3": "ecdfe0c4819d0c67c219e9365c666a6c59215abe274856d8927600288b1a35eb"
}
